URL,Meta Title,Title Length,Meta Description,Meta Description Length,Canonical,,Paragraph,H2,H3,H4,H5,H6
https://leadweb-vert.vercel.app/google-ads-agency-penrith/,Google Ads Agency Penrith | Leadweb Marketing,45,"Penrith Google Ads management with weekly optimisation, transparent reporting and no lock-in contracts.",103,https://www.leadweb.com.au/google-ads-agency-penrith/,google ads agency penrith,Google Ads agency in Penrith for owners who are done overpaying for leads.,"Why Penrith owners work with us | What you actually get | Every service, run for Penrith businesses | Serving all of Penrith | Recent work | Ready to stop losing leads to the competition?",Google Ads — Penrith | Google Ads | SEO | Web Design | Social Media Marketing | Pay Per Lead | Rent a Website,Services | Industries | Locations,,
https://leadweb-vert.vercel.app/google-ads-agency-bankstown/,Google Ads Agency Bankstown | Leadweb Marketing,47,"Bankstown Google Ads management with weekly optimisation, transparent reporting and no lock-in contracts.",105,https://www.leadweb.com.au/google-ads-agency-bankstown/,google ads agency bankstown,Google Ads agency in Bankstown for owners who are done overpaying for leads.,"Why Bankstown owners work with us | What you actually get | Every service, run for Bankstown businesses | Serving all of Bankstown | Recent work | Ready to stop losing leads to the competition?",Google Ads — Bankstown | Google Ads | SEO | Web Design | Social Media Marketing | Pay Per Lead | Rent a Website,Services | Industries | Locations,,
https://leadweb-vert.vercel.app/google-ads-agency-campbelltown/,Google Ads Agency Campbelltown | Leadweb Marketing,50,"Campbelltown Google Ads management with weekly optimisation, transparent reporting and no lock-in contracts.",108,https://www.leadweb.com.au/google-ads-agency-campbelltown/,google ads agency campbelltown,Google Ads agency in Campbelltown for owners who are done overpaying for leads.,"Why Campbelltown owners work with us | What you actually get | Every service, run for Campbelltown businesses | Serving all of Campbelltown | Recent work | Ready to stop losing leads to the competition?",Google Ads — Campbelltown | Google Ads | SEO | Web Design | Social Media Marketing | Pay Per Lead | Rent a Website,Services | Industries | Locations,,
https://leadweb-vert.vercel.app/google-ads-agency-wollongong/,Google Ads Agency Wollongong | Leadweb Marketing,48,"Wollongong Google Ads management with weekly optimisation, transparent reporting and no lock-in contracts.",106,https://www.leadweb.com.au/google-ads-agency-wollongong/,google ads agency wollongong,Google Ads agency in Wollongong for owners who are done overpaying for leads.,"Why Wollongong owners work with us | What you actually get | Every service, run for Wollongong businesses | Serving all of Wollongong | Recent work | Ready to stop losing leads to the competition?",Google Ads — Wollongong | Google Ads | SEO | Web Design | Social Media Marketing | Pay Per Lead | Rent a Website,Services | Industries | Locations,,
https://leadweb-vert.vercel.app/google-ads-agency-newcastle/,Google Ads Agency Newcastle | Leadweb Marketing,47,"Newcastle Google Ads management with weekly optimisation, transparent reporting and no lock-in contracts.",105,https://www.leadweb.com.au/google-ads-agency-newcastle/,google ads agency new castle,Google Ads agency in Newcastle for owners who are done overpaying for leads.,"Why Newcastle owners work with us | What you actually get | Every service, run for Newcastle businesses | Serving all of Newcastle | Recent work | Ready to stop losing leads to the competition?",Google Ads — Newcastle | Google Ads | SEO | Web Design | Social Media Marketing | Pay Per Lead | Rent a Website,Services | Industries | Locations,,
https://leadweb-vert.vercel.app/google-ads-agency-chatswood/,Google Ads Agency Chatswood | Leadweb Marketing,47,"Chatswood Google Ads management with weekly optimisation, transparent reporting and no lock-in contracts.",105,https://www.leadweb.com.au/google-ads-agency-chatswood/,google ads agency chatswood,Google Ads agency in Chatswood for owners who are done overpaying for leads.,"Why Chatswood owners work with us | What you actually get | Every service, run for Chatswood businesses | Serving all of Chatswood | Recent work | Ready to stop losing leads to the competition?",Google Ads — Chatswood | Google Ads | SEO | Web Design | Social Media Marketing | Pay Per Lead | Rent a Website,Services | Industries | Locations,,
https://leadweb-vert.vercel.app/google-ads-agency-burwood/,Google Ads Agency Burwood | Leadweb Marketing,45,"Burwood Google Ads management with weekly optimisation, transparent reporting and no lock-in contracts.",103,https://www.leadweb.com.au/google-ads-agency-burwood/,google ads agency burwood,Google Ads agency in Burwood for owners who are done overpaying for leads.,"Why Burwood owners work with us | What you actually get | Every service, run for Burwood businesses | Serving all of Burwood | Recent work | Ready to stop losing leads to the competition?",Google Ads — Burwood | Google Ads | SEO | Web Design | Social Media Marketing | Pay Per Lead | Rent a Website,Services | Industries | Locations,,
https://leadweb-vert.vercel.app/google-ads-agency-balmain/,Google Ads Agency Balmain | Leadweb Marketing,45,"Balmain Google Ads management with weekly optimisation, transparent reporting and no lock-in contracts.",103,https://www.leadweb.com.au/google-ads-agency-balmain/,google ads agency balmain,Google Ads agency in Balmain for owners who are done overpaying for leads.,"Why Balmain owners work with us | What you actually get | Every service, run for Balmain businesses | Serving all of Balmain | Recent work | Ready to stop losing leads to the competition?",Google Ads — Balmain | Google Ads | SEO | Web Design | Social Media Marketing | Pay Per Lead | Rent a Website,Services | Industries | Locations,,
https://leadweb-vert.vercel.app/google-ads-agency-bondi/,Google Ads Agency Bondi | Leadweb Marketing,43,"Bondi Google Ads management with weekly optimisation, transparent reporting and no lock-in contracts.",101,https://www.leadweb.com.au/google-ads-agency-bondi/,google ads agency bondi,Google Ads agency in Bondi for owners who are done overpaying for leads.,"Why Bondi owners work with us | What you actually get | Every service, run for Bondi businesses | Serving all of Bondi | Recent work | Ready to stop losing leads to the competition?",Google Ads — Bondi | Google Ads | SEO | Web Design | Social Media Marketing | Pay Per Lead | Rent a Website,Services | Industries | Locations,,
https://leadweb-vert.vercel.app/google-ads-agency-double-bay/,Google Ads Agency Double Bay | Leadweb Marketing,48,"Double Bay Google Ads management with weekly optimisation, transparent reporting and no lock-in contracts.",106,https://www.leadweb.com.au/google-ads-agency-double-bay/,google ads agency double bay,Google Ads agency in Double Bay for owners who are done overpaying for leads.,"Why Double Bay owners work with us | What you actually get | Every service, run for Double Bay businesses | Serving all of Double Bay | Recent work | Ready to stop losing leads to the competition?",Google Ads — Double Bay | Google Ads | SEO | Web Design | Social Media Marketing | Pay Per Lead | Rent a Website,Services | Industries | Locations,,
https://leadweb-vert.vercel.app/digital-marketing-agency-sydney/,Digital Marketing Agency Sydney | Leadweb Marketing,51,"Sydney digital marketing agency covering SEO, Google Ads, social and web. Revenue-first reporting, no lock-in.",110,https://www.leadweb.com.au/digital-marketing-agency-sydney/,digital marketing agency sydney,Digital marketing agency in Sydney that ties every channel to booked revenue.,"Why Sydney owners work with us | Every service, run for Sydney businesses | Serving all of Sydney | Recent work | Ready to stop losing leads to the competition?",Digital Marketing — Sydney | Google Ads | SEO | Web Design | Social Media Marketing | Pay Per Lead | Rent a Website,Services | Industries | Locations,,
https://leadweb-vert.vercel.app/digital-marketing-agency-melbourne/,Digital Marketing Agency Melbourne | Leadweb Marketing,54,"Melbourne digital marketing agency covering SEO, Google Ads, social and web. Revenue-first reporting, no lock-in.",113,https://www.leadweb.com.au/digital-marketing-agency-melbourne/,digital marketing agency melbourne,Digital marketing agency in Melbourne that ties every channel to booked revenue.,"Why Melbourne owners work with us | Every service, run for Melbourne businesses | Serving all of Melbourne | Recent work | Ready to stop losing leads to the competition?",Digital Marketing — Melbourne | Google Ads | SEO | Web Design | Social Media Marketing | Pay Per Lead | Rent a Website,Services | Industries | Locations,,
https://leadweb-vert.vercel.app/digital-marketing-agency-brisbane/,Digital Marketing Agency Brisbane | Leadweb Marketing,53,"Brisbane digital marketing agency covering SEO, Google Ads, social and web. Revenue-first reporting, no lock-in.",112,https://www.leadweb.com.au/digital-marketing-agency-brisbane/,digital marketing agency brisbane,Digital marketing agency in Brisbane that ties every channel to booked revenue.,"Why Brisbane owners work with us | Every service, run for Brisbane businesses | Serving all of Brisbane | Recent work | Ready to stop losing leads to the competition?",Digital Marketing — Brisbane | Google Ads | SEO | Web Design | Social Media Marketing | Pay Per Lead | Rent a Website,Services | Industries | Locations,,
https://leadweb-vert.vercel.app/digital-marketing-agency-perth/,Digital Marketing Agency Perth | Leadweb Marketing,50,"Perth digital marketing agency covering SEO, Google Ads, social and web. Revenue-first reporting, no lock-in.",109,https://www.leadweb.com.au/digital-marketing-agency-perth/,digital marketing agency perth,Digital marketing agency in Perth that ties every channel to booked revenue.,"Why Perth owners work with us | Every service, run for Perth businesses | Serving all of Perth | Recent work | Ready to stop losing leads to the competition?",Digital Marketing — Perth | Google Ads | SEO | Web Design | Social Media Marketing | Pay Per Lead | Rent a Website,Services | Industries | Locations,,
https://leadweb-vert.vercel.app/digital-marketing-agency-adelaide/,Digital Marketing Agency Adelaide | Leadweb Marketing,53,"Adelaide digital marketing agency covering SEO, Google Ads, social and web. Revenue-first reporting, no lock-in.",112,https://www.leadweb.com.au/digital-marketing-agency-adelaide/,digital marketing agency adelaide,Digital marketing agency in Adelaide that ties every channel to booked revenue.,"Why Adelaide owners work with us | Every service, run for Adelaide businesses | Serving all of Adelaide | Recent work | Ready to stop losing leads to the competition?",Digital Marketing — Adelaide | Google Ads | SEO | Web Design | Social Media Marketing | Pay Per Lead | Rent a Website,Services | Industries | Locations,,
https://leadweb-vert.vercel.app/digital-marketing-agency-parramatta/,Digital Marketing Agency Parramatta | Leadweb Marketing,55,"Parramatta digital marketing agency covering SEO, Google Ads, social and web. Revenue-first reporting, no lock-in.",114,https://www.leadweb.com.au/digital-marketing-agency-parramatta/,digital marketing agency parramatta,Digital marketing agency in Parramatta that ties every channel to booked revenue.,"Why Parramatta owners work with us | What you actually get | Every service, run for Parramatta businesses | Serving all of Parramatta | Recent work | Ready to stop losing leads to the competition?",Digital Marketing — Parramatta | Google Ads | SEO | Web Design | Social Media Marketing | Pay Per Lead | Rent a Website,Services | Industries | Locations,,
https://leadweb-vert.vercel.app/digital-marketing-agency-blacktown/,Digital Marketing Agency Blacktown | Leadweb Marketing,54,"Blacktown digital marketing agency covering SEO, Google Ads, social and web. Revenue-first reporting, no lock-in.",113,https://www.leadweb.com.au/digital-marketing-agency-blacktown/,digital marketing agency blacktown,Digital marketing agency in Blacktown that ties every channel to booked revenue.,"Why Blacktown owners work with us | What you actually get | Every service, run for Blacktown businesses | Serving all of Blacktown | Recent work | Ready to stop losing leads to the competition?",Digital Marketing — Blacktown | Google Ads | SEO | Web Design | Social Media Marketing | Pay Per Lead | Rent a Website,Services | Industries | Locations,,
https://leadweb-vert.vercel.app/digital-marketing-agency-penrith/,Digital Marketing Agency Penrith | Leadweb Marketing,52,"Penrith digital marketing agency covering SEO, Google Ads, social and web. Revenue-first reporting, no lock-in.",111,https://www.leadweb.com.au/digital-marketing-agency-penrith/,digital marketing agency penrith,Digital marketing agency in Penrith that ties every channel to booked revenue.,"Why Penrith owners work with us | What you actually get | Every service, run for Penrith businesses | Serving all of Penrith | Recent work | Ready to stop losing leads to the competition?",Digital Marketing — Penrith | Google Ads | SEO | Web Design | Social Media Marketing | Pay Per Lead | Rent a Website,Services | Industries | Locations,,
https://leadweb-vert.vercel.app/digital-marketing-agency-bankstown/,Digital Marketing Agency Bankstown | Leadweb Marketing,54,"Bankstown digital marketing agency covering SEO, Google Ads, social and web. Revenue-first reporting, no lock-in.",113,https://www.leadweb.com.au/digital-marketing-agency-bankstown/,digital marketing agency bankstown,Digital marketing agency in Bankstown that ties every channel to booked revenue.,"Why Bankstown owners work with us | What you actually get | Every service, run for Bankstown businesses | Serving all of Bankstown | Recent work | Ready to stop losing leads to the competition?",Digital Marketing — Bankstown | Google Ads | SEO | Web Design | Social Media Marketing | Pay Per Lead | Rent a Website,Services | Industries | Locations,,
https://leadweb-vert.vercel.app/digital-marketing-agency-campbelltown/,Digital Marketing Agency Campbelltown | Leadweb Marketing,57,"Campbelltown digital marketing agency covering SEO, Google Ads, social and web. Revenue-first reporting, no lock-in.",116,https://www.leadweb.com.au/digital-marketing-agency-campbelltown/,digital marketing agency campbelltown,Digital marketing agency in Campbelltown that ties every channel to booked revenue.,"Why Campbelltown owners work with us | What you actually get | Every service, run for Campbelltown businesses | Serving all of Campbelltown | Recent work | Ready to stop losing leads to the competition?",Digital Marketing — Campbelltown | Google Ads | SEO | Web Design | Social Media Marketing | Pay Per Lead | Rent a Website,Services | Industries | Locations,,
https://leadweb-vert.vercel.app/digital-marketing-agency-wollongong/,Digital Marketing Agency Wollongong | Leadweb Marketing,55,"Wollongong digital marketing agency covering SEO, Google Ads, social and web. Revenue-first reporting, no lock-in.",114,https://www.leadweb.com.au/digital-marketing-agency-wollongong/,digital marketing agency wollongong,Digital marketing agency in Wollongong that ties every channel to booked revenue.,"Why Wollongong owners work with us | What you actually get | Every service, run for Wollongong businesses | Serving all of Wollongong | Recent work | Ready to stop losing leads to the competition?",Digital Marketing — Wollongong | Google Ads | SEO | Web Design | Social Media Marketing | Pay Per Lead | Rent a Website,Services | Industries | Locations,,
https://leadweb-vert.vercel.app/digital-marketing-agency-newcastle/,Digital Marketing Agency Newcastle | Leadweb Marketing,54,"Newcastle digital marketing agency covering SEO, Google Ads, social and web. Revenue-first reporting, no lock-in.",113,https://www.leadweb.com.au/digital-marketing-agency-newcastle/,digital marketing agency new castle,Digital marketing agency in Newcastle that ties every channel to booked revenue.,"Why Newcastle owners work with us | What you actually get | Every service, run for Newcastle businesses | Serving all of Newcastle | Recent work | Ready to stop losing leads to the competition?",Digital Marketing — Newcastle | Google Ads | SEO | Web Design | Social Media Marketing | Pay Per Lead | Rent a Website,Services | Industries | Locations,,
https://leadweb-vert.vercel.app/digital-marketing-agency-chatswood/,Digital Marketing Agency Chatswood | Leadweb Marketing,54,"Chatswood digital marketing agency covering SEO, Google Ads, social and web. Revenue-first reporting, no lock-in.",113,https://www.leadweb.com.au/digital-marketing-agency-chatswood/,digital marketing agency chatswood,Digital marketing agency in Chatswood that ties every channel to booked revenue.,"Why Chatswood owners work with us | What you actually get | Every service, run for Chatswood businesses | Serving all of Chatswood | Recent work | Ready to stop losing leads to the competition?",Digital Marketing — Chatswood | Google Ads | SEO | Web Design | Social Media Marketing | Pay Per Lead | Rent a Website,Services | Industries | Locations,,
https://leadweb-vert.vercel.app/digital-marketing-agency-burwood/,Digital Marketing Agency Burwood | Leadweb Marketing,52,"Burwood digital marketing agency covering SEO, Google Ads, social and web. Revenue-first reporting, no lock-in.",111,https://www.leadweb.com.au/digital-marketing-agency-burwood/,digital marketing agency burwood,Digital marketing agency in Burwood that ties every channel to booked revenue.,"Why Burwood owners work with us | What you actually get | Every service, run for Burwood businesses | Serving all of Burwood | Recent work | Ready to stop losing leads to the competition?",Digital Marketing — Burwood | Google Ads | SEO | Web Design | Social Media Marketing | Pay Per Lead | Rent a Website,Services | Industries | Locations,,
https://leadweb-vert.vercel.app/digital-marketing-agency-balmain/,Digital Marketing Agency Balmain | Leadweb Marketing,52,"Balmain digital marketing agency covering SEO, Google Ads, social and web. Revenue-first reporting, no lock-in.",111,https://www.leadweb.com.au/digital-marketing-agency-balmain/,digital marketing agency balmain,Digital marketing agency in Balmain that ties every channel to booked revenue.,"Why Balmain owners work with us | What you actually get | Every service, run for Balmain businesses | Serving all of Balmain | Recent work | Ready to stop losing leads to the competition?",Digital Marketing — Balmain | Google Ads | SEO | Web Design | Social Media Marketing | Pay Per Lead | Rent a Website,Services | Industries | Locations,,
https://leadweb-vert.vercel.app/digital-marketing-agency-bondi/,Digital Marketing Agency Bondi | Leadweb Marketing,50,"Bondi digital marketing agency covering SEO, Google Ads, social and web. Revenue-first reporting, no lock-in.",109,https://www.leadweb.com.au/digital-marketing-agency-bondi/,digital marketing agency bondi,Digital marketing agency in Bondi that ties every channel to booked revenue.,"Why Bondi owners work with us | What you actually get | Every service, run for Bondi businesses | Serving all of Bondi | Recent work | Ready to stop losing leads to the competition?",Digital Marketing — Bondi | Google Ads | SEO | Web Design | Social Media Marketing | Pay Per Lead | Rent a Website,Services | Industries | Locations,,
https://leadweb-vert.vercel.app/digital-marketing-agency-double-bay/,Digital Marketing Agency Double Bay | Leadweb Marketing,55,"Double Bay digital marketing agency covering SEO, Google Ads, social and web. Revenue-first reporting, no lock-in.",114,https://www.leadweb.com.au/digital-marketing-agency-double-bay/,digital marketing agency double bay,Digital marketing agency in Double Bay that ties every channel to booked revenue.,"Why Double Bay owners work with us | What you actually get | Every service, run for Double Bay businesses | Serving all of Double Bay | Recent work | Ready to stop losing leads to the competition?",Digital Marketing — Double Bay | Google Ads | SEO | Web Design | Social Media Marketing | Pay Per Lead | Rent a Website,Services | Industries | Locations,,
https://leadweb-vert.vercel.app/seo-agency-sydney/,"SEO Agency Sydney | Technical SEO, Local SEO and Content SEO",60,"Sydney SEO agency ranking service businesses on revenue-moving terms. Technical, on-page, content and local pack — all in-house.",128,https://www.leadweb.com.au/seo-agency-sydney/,seo agency sydney,SEO agency in Sydney for owners who want rankings tied to revenue.,"Why Sydney owners work with us | Every service, run for Sydney businesses | Serving all of Sydney | Recent work | Ready to stop losing leads to the competition?",SEO — Sydney | Google Ads | SEO | Web Design | Social Media Marketing | Pay Per Lead | Rent a Website,Services | Industries | Locations,,
https://leadweb-vert.vercel.app/seo-agency-melbourne/,SEO Agency Melbourne | Rank organically and generate leads,58,"Melbourne SEO agency ranking service businesses on revenue-moving terms. Technical, on-page, content and local pack — all in-house.",131,https://www.leadweb.com.au/seo-agency-melbourne/,seo agency melbourne,SEO agency in Melbourne for owners who want rankings tied to revenue.,"Why Melbourne owners work with us | Every service, run for Melbourne businesses | Serving all of Melbourne | Recent work | Ready to stop losing leads to the competition?",SEO — Melbourne | Google Ads | SEO | Web Design | Social Media Marketing | Pay Per Lead | Rent a Website,Services | Industries | Locations,,
https://leadweb-vert.vercel.app/seo-agency-brisbane/,SEO Agency Brisbane | Rank in targeted locations for your services,66,"Brisbane SEO agency ranking service businesses on revenue-moving terms. Technical, on-page, content and local pack — all in-house.",130,https://www.leadweb.com.au/seo-agency-brisbane/,seo agency brisbane,SEO agency in Brisbane for owners who want rankings tied to revenue.,"Why Brisbane owners work with us | Every service, run for Brisbane businesses | Serving all of Brisbane | Recent work | Ready to stop losing leads to the competition?",SEO — Brisbane | Google Ads | SEO | Web Design | Social Media Marketing | Pay Per Lead | Rent a Website,Services | Industries | Locations,,
https://leadweb-vert.vercel.app/seo-agency-perth/,SEO Agency Perth | Leadweb Marketing,36,"Perth SEO agency ranking service businesses on revenue-moving terms. Technical, on-page, content and local pack — all in-house.",127,https://www.leadweb.com.au/seo-agency-perth/,seo agency perth,SEO agency in Perth for owners who want rankings tied to revenue.,"Why Perth owners work with us | Every service, run for Perth businesses | Serving all of Perth | Recent work | Ready to stop losing leads to the competition?",SEO — Perth | Google Ads | SEO | Web Design | Social Media Marketing | Pay Per Lead | Rent a Website,Services | Industries | Locations,,
https://leadweb-vert.vercel.app/seo-agency-adelaide/,SEO Agency Adelaide | Leadweb Marketing,39,"Adelaide SEO agency ranking service businesses on revenue-moving terms. Technical, on-page, content and local pack — all in-house.",130,https://www.leadweb.com.au/seo-agency-adelaide/,seo agency adelaide,SEO agency in Adelaide for owners who want rankings tied to revenue.,"Why Adelaide owners work with us | Every service, run for Adelaide businesses | Serving all of Adelaide | Recent work | Ready to stop losing leads to the competition?",SEO — Adelaide | Google Ads | SEO | Web Design | Social Media Marketing | Pay Per Lead | Rent a Website,Services | Industries | Locations,,
https://leadweb-vert.vercel.app/seo-agency-parramatta/,SEO Agency Parramatta | Leadweb Marketing,41,"Parramatta SEO agency ranking service businesses on revenue-moving terms. Technical, on-page, content and local pack — all in-house.",132,https://www.leadweb.com.au/seo-agency-parramatta/,seo agency parramatta,SEO agency in Parramatta for owners who want rankings tied to revenue.,"Why Parramatta owners work with us | What you actually get | Every service, run for Parramatta businesses | Serving all of Parramatta | Recent work | Ready to stop losing leads to the competition?",SEO — Parramatta | Google Ads | SEO | Web Design | Social Media Marketing | Pay Per Lead | Rent a Website,Services | Industries | Locations,,
https://leadweb-vert.vercel.app/seo-agency-blacktown/,SEO Agency Blacktown | Leadweb Marketing,40,"Blacktown SEO agency ranking service businesses on revenue-moving terms. Technical, on-page, content and local pack — all in-house.",131,https://www.leadweb.com.au/seo-agency-blacktown/,seo agency blacktown,SEO agency in Blacktown for owners who want rankings tied to revenue.,"Why Blacktown owners work with us | What you actually get | Every service, run for Blacktown businesses | Serving all of Blacktown | Recent work | Ready to stop losing leads to the competition?",SEO — Blacktown | Google Ads | SEO | Web Design | Social Media Marketing | Pay Per Lead | Rent a Website,Services | Industries | Locations,,
https://leadweb-vert.vercel.app/seo-agency-penrith/,SEO Agency Penrith | Leadweb Marketing,38,"Penrith SEO agency ranking service businesses on revenue-moving terms. Technical, on-page, content and local pack — all in-house.",129,https://www.leadweb.com.au/seo-agency-penrith/,seo agency penrith,SEO agency in Penrith for owners who want rankings tied to revenue.,"Why Penrith owners work with us | What you actually get | Every service, run for Penrith businesses | Serving all of Penrith | Recent work | Ready to stop losing leads to the competition?",SEO — Penrith | Google Ads | SEO | Web Design | Social Media Marketing | Pay Per Lead | Rent a Website,Services | Industries | Locations,,
