URL,Meta Title,Title Length,Meta Description,Meta Description Length,Canonical,,Paragraph,H2,H3,H4,H5,H6
https://leadweb-vert.vercel.app/,Leadweb Marketing I SEO Google Ads Pay Per Lead and More,56,"Leadweb is a Sydney digital marketing agency for owners who are done chasing leads. Google Ads, SEO, websites and pay-per-lead — measured in booked jobs, not clicks.",165,https://www.leadweb.com.au,Leadweb Marketing,Your business isn't broken. Your lead flow is.,Six ways we get owners more of the right leads. | Why Australian owners choose Leadweb | Real clients. Real search results. Real phones ringing. | We know these industries because we've worked in them. | Weekly work. Monthly reviews. Reports that fit on one screen. | You already know what needs fixing. Let's fix it.,"Google Ads | SEO | Web Design | Social Media Marketing | Pay Per Lead | Rent a Website | Traffic that converts | Real phones ringing | Numbers, not fluff | You get a strategist, not an account handler | We ship every week | Reports a business owner can read | No lock-in, no lost work",Services | Industries | Locations,,
https://leadweb-vert.vercel.app/about-us/,About Leadweb I Digital Marketing and Lead Generation Agency,60,"Sydney-based digital marketing agency. Owner-operated. Twelve years running paid, SEO and web for Australian businesses that measure success in booked jobs.",156,https://www.leadweb.com.au/about-us/,About Us,"Owner-operated. Sydney-based. Built for people who read the P&L, not the impressions report.",What we believe. | Ready to stop losing leads to the competition?,,Services | Industries | Locations,,
https://leadweb-vert.vercel.app/contact-us/,Contact Leadweb — Digital Marketing and Lead Generation Agency,62,"Book a 20-minute strategy call. We'll audit your current lead flow, spot the leaks, and give you a plan you can action.",119,https://www.leadweb.com.au/contact-us/,contact Leadweb Marketing,Let's talk about where your leads are actually leaking.,,Book a strategy call,Services | Industries | Locations,,
https://leadweb-vert.vercel.app/services/,Digital Marketing Services — Google Ads SEO and Pay Per Lead,60,"Google Ads, SEO, websites, social media, pay-per-lead and rent-a-website — every service built to move revenue, not vanity metrics.",131,https://www.leadweb.com.au/services/,Digital Marketing Services,One standard across every service: measured in booked jobs.,Ready to stop losing leads to the competition?,Google Ads | SEO | Web Design | Social Media Marketing | Pay Per Lead | Rent a Website,Services | Industries | Locations,,
https://leadweb-vert.vercel.app/services/google-ads/,Google Ads Services | Leadweb Marketing,39,"Google Ads built around booked jobs, not click reports. Weekly optimisation, tight negative lists, landing pages that convert. Sydney-based.",140,https://www.leadweb.com.au/services/google-ads/,Google Ads Services,Google Ads that stop bleeding budget on tyre-kickers.,Sound familiar? | How we run it | What you get | Why Australian businesses choose Leadweb for Google Ads | Recent work | Questions we get asked | Explore other services | Ready to stop losing leads to the competition?,Get a Google Ads audit | Week 1 — Account autopsy | Week 2 — Restructure | Week 3 — Landing pages | Ongoing — Weekly ops | Weekly work in the account | A real person on the line | Reporting tied to booked jobs | SEO | Web Design | Social Media Marketing,Services | Industries | Locations,,
https://leadweb-vert.vercel.app/services/seo/,Search Engine Optimisation | Leadweb Marketing,46,"SEO that moves revenue: technical fixes, category and location pages built for conversion, and outreach that earns links that actually rank.",140,https://www.leadweb.com.au/services/seo/,SEO services,"SEO measured in booked jobs, not backlink counts.",Sound familiar? | How we run it | What you get | Why Australian businesses choose Leadweb for SEO | Recent work | Questions we get asked | Explore other services | Ready to stop losing leads to the competition?,Get an SEO revenue audit | 1. Revenue-mapped keyword strategy | 2. Technical baseline | 3. Conversion-first content | 4. Links you'd be proud to name | Weekly work in the account | A real person on the line | Reporting tied to booked jobs | Google Ads | Web Design | Social Media Marketing,Services | Industries | Locations,,
https://leadweb-vert.vercel.app/services/web-design/,Web Design & Development Sydney | Leadweb Marketing,51,"Fast, conversion-focused websites for service businesses. Built to rank on Google and turn traffic into booked jobs.",116,https://www.leadweb.com.au/services/web-design/,web design services,Websites that look sharp and convert like a landing page.,Sound familiar? | How we run it | What you get | Why Australian businesses choose Leadweb for Web Design | Recent work | Questions we get asked | Explore other services | Ready to stop losing leads to the competition?,Start a website brief | 1. Positioning + IA | 2. Conversion-first design | 3. Engineered for speed | 4. You edit it yourself | Weekly work in the account | A real person on the line | Reporting tied to booked jobs | Google Ads | SEO | Social Media Marketing,Services | Industries | Locations,,
https://leadweb-vert.vercel.app/services/social-media-marketing/,Social Media Marketing Sydney | Leadweb Marketing,49,"Organic + paid social that builds trust, warms your list, and shortens the sales cycle. For service businesses that want more than likes.",137,https://www.leadweb.com.au/services/social-media-marketing/,social media marketing services,Social that supports the sale — not just the vanity metrics.,Sound familiar? | How we run it | What you get | Why Australian businesses choose Leadweb for Social Media Marketing | Recent work | Questions we get asked | Explore other services | Ready to stop losing leads to the competition?,Start a social brief | 1. Content that answers real buyer questions | 2. Native production | 3. Paid amplification | 4. Measured on pipeline | Weekly work in the account | A real person on the line | Reporting tied to booked jobs | Google Ads | SEO | Web Design,Services | Industries | Locations,,
https://leadweb-vert.vercel.app/services/pay-per-lead/,Pay Per Lead | Pay for Results Not the Process I Leadweb,56,"Pay Per Lead service Australiawide. We build the website, run the campaigns, rank on page one — you only pay for genuine phone calls and enquiries. Exclusive to your business.",175,https://www.leadweb.com.au/services/pay-per-lead/,pay per lead service,Pay Per Lead Service,Why Pay Per Lead? | So How we do it & What are the choices? | Let the Results speak for Us | Why Us? | Why Australian businesses choose Leadweb for Pay Per Lead | Recent work | Questions we get asked | Explore other services | Ready to stop losing leads to the competition?,Get a pay-per-lead quote | Key Facts of Focus | Local Understanding | Expert Execution | Creative & Technology | Call Tracking & Reporting | Up-keep | Results | Weekly work in the account | A real person on the line | Reporting tied to booked jobs | Google Ads | SEO | Web Design,Services | Industries | Locations,,
https://leadweb-vert.vercel.app/services/rent-website/,Rent a Website Service | Hire a Top Ranking Website I Leadweb,61,"Move into a website we've already built, ranked, and tuned for your industry and postcode. Fixed monthly rent, leads from day one.",130,https://www.leadweb.com.au/services/rent-website/,rent website service,"A ranked, converting website on a monthly rent — no build cost.",Sound familiar? | How we run it | What you get | Why Australian businesses choose Leadweb for Rent a Website | Recent work | Questions we get asked | Explore other services | Ready to stop losing leads to the competition?,Check availability in your postcode | 1. We check availability in your postcode | 2. We rebrand the site to your business | 3. Leads route to you | 4. Fixed monthly rent | Weekly work in the account | A real person on the line | Reporting tied to booked jobs | Google Ads | SEO | Web Design,Services | Industries | Locations,,
https://leadweb-vert.vercel.app/industries/,Industries We Work With — Leadweb Marketing,43,"Digital marketing playbooks for tradies, dentists, law firms, real estate, financial services, non-profits and more.",116,https://www.leadweb.com.au/industries/,industries we serve ,Every industry gets its own playbook.,Ready to stop losing leads to the competition?,Tradies | Dentists | Doctors & Clinics | Financial Services | Fitness & Gyms | Law Firms | Non-Profits | Professional Services | Real Estate | Restaurants & Hospitality | Small Business | Beauty & Skincare,Services | Industries | Locations,,
https://leadweb-vert.vercel.app/industries/digital-marketing-for-tradies,"Digital Marketing for Tradies | SEO, Google Ads Leads and More",62,"Google Ads, SEO and pay-per-lead built for electricians, plumbers, builders, tree loppers and removalists. Booked jobs, not clicks.",131,https://www.leadweb.com.au/industries/digital-marketing-for-tradies/,digital marketing for tradies,Digital marketing for tradies who want the phone ringing before smoko.,What we do differently for tradies | Why tradies choose Leadweb | The playbook | Channels we run for tradies | Recent work | Ready to stop losing leads to the competition?,"Marketing for tradies | Traffic that converts | Real phones ringing | Numbers, not fluff | Own your suburbs | Google Business Profile that actually books | Ads that survive the news cycle | Report on jobs, not clicks | Google Ads | SEO | Web Design | Social Media Marketing",Services | Industries | Locations,,
https://leadweb-vert.vercel.app/industries/digital-marketing-for-dentists/,Digital Marketing for Dentists | Leadweb Marketing,50,"SEO, Google Ads and websites for dental practices. New patient enquiries measured against chair utilisation, not vanity metrics.",128,https://www.leadweb.com.au/industries/digital-marketing-for-dentists/,digital marketing for dentists,Marketing for dental practices that fills the chair — not the CRM.,What we do differently for dentists | Why dentists choose Leadweb | The playbook | Channels we run for dentists | Recent work | Ready to stop losing leads to the competition?,"Marketing for dentists | Traffic that converts | Real phones ringing | Numbers, not fluff | Treatment-led SEO | Reviews as a growth channel | Ads that respect the funnel | Track down to the chair | Google Ads | SEO | Web Design | Social Media Marketing",Services | Industries | Locations,,
https://leadweb-vert.vercel.app/industries/digital-marketing-for-doctors/,Digital Marketing for Doctors & Clinics | Leadweb Marketing,59,"Compliant, effective SEO and paid media for medical clinics and allied health providers. New patient bookings, measured properly.",129,https://www.leadweb.com.au/industries/digital-marketing-for-doctors/,digital marketing for doctors,"Patient acquisition for GPs, allied health and specialist clinics.",What we do differently for doctors & clinics | Why doctors & clinics choose Leadweb | The playbook | Channels we run for doctors & clinics | Recent work | Ready to stop losing leads to the competition?,"Marketing for doctors & clinics | Traffic that converts | Real phones ringing | Numbers, not fluff | Condition + treatment pages | Booking-first UX | Reviews without pressure tactics | Google Ads | SEO | Web Design | Social Media Marketing",Services | Industries | Locations,,
https://leadweb-vert.vercel.app/industries/digital-marketing-for-financial-services/,Digital Marketing for Financial Services | Leadweb Marketing,60,"Compliant, high-intent lead generation for mortgage brokers, financial advisers and fintech. Qualified enquiries, not lead-gen junk.",132,https://www.leadweb.com.au/industries/digital-marketing-for-financial-services/,digital marketing for financial services,"Digital marketing for brokers, advisers and financial services businesses.",What we do differently for financial services | Why financial services choose Leadweb | The playbook | Channels we run for financial services | Recent work | Ready to stop losing leads to the competition?,"Marketing for financial services | Traffic that converts | Real phones ringing | Numbers, not fluff | Qualify before the call | Rank for the money terms | Nurture that respects the buyer | Google Ads | SEO | Web Design | Social Media Marketing",Services | Industries | Locations,,
https://leadweb-vert.vercel.app/industries/digital-marketing-for-fitness-centres,Digital Marketing for Gyms & Fitness | Leadweb Marketing,56,"Marketing for gyms, PT studios and boutique fitness. Trial-to-member conversion beats cheap leads, every time.",110,https://www.leadweb.com.au/industries/digital-marketing-for-fitness-centres,digital marketing for fitness centres,Fill your gym floor with members who actually stay.,What we do differently for fitness & gyms | Why fitness & gyms choose Leadweb | The playbook | Channels we run for fitness & gyms | Recent work | Ready to stop losing leads to the competition?,"Marketing for fitness & gyms | Traffic that converts | Real phones ringing | Numbers, not fluff | Trial that filters | Onboarding as marketing | Community content | Google Ads | SEO | Web Design | Social Media Marketing",Services | Industries | Locations,,
https://leadweb-vert.vercel.app/industries/digital-marketing-for-law-firms/,Digital Marketing for Law Firms | Leadweb Marketing,51,"SEO, Google Ads and content marketing for family, criminal, commercial and personal injury firms. Qualified matters, tracked to intake.",135,https://www.leadweb.com.au/industries/digital-marketing-for-law-firms/,digital marketing for law firms,"Marketing for law firms that brings in matters, not just enquiries.",What we do differently for law firms | Why law firms choose Leadweb | The playbook | Channels we run for law firms | Recent work | Ready to stop losing leads to the competition?,"Marketing for law firms | Traffic that converts | Real phones ringing | Numbers, not fluff | Rank on practice + location | Author-driven content | Qualify at the form | Google Ads | SEO | Web Design | Social Media Marketing",Services | Industries | Locations,,
https://leadweb-vert.vercel.app/industries/digital-marketing-for-non-profits/,Digital Marketing for Non-Profits | Leadweb Marketing,53,"Google Ad Grants, SEO and campaign management for Australian non-profits. Every dollar reported against impact.",111,https://www.leadweb.com.au/industries/digital-marketing-for-non-profits/,digital marketing for non profits,Marketing for non-profits that grows donations and awareness.,What we do differently for non-profits | Why non-profits choose Leadweb | The playbook | Channels we run for non-profits | Recent work | Ready to stop losing leads to the competition?,"Marketing for non-profits | Traffic that converts | Real phones ringing | Numbers, not fluff | Use the grant properly | Donation pages that convert | Own the search results on your cause | Google Ads | SEO | Web Design | Social Media Marketing",Services | Industries | Locations,,
https://leadweb-vert.vercel.app/industries/digital-marketing-for-professional-services/,Digital Marketing for Professional Services | Leadweb Marketing,63,"Positioning, SEO and paid media for consultancies, accountants, agencies and B2B service firms.",95,https://www.leadweb.com.au/industries/digital-marketing-for-professional-services/,digital marketing for professional services,Marketing for consultancies and professional services firms.,What we do differently for professional services | Why professional services choose Leadweb | The playbook | Channels we run for professional services | Recent work | Ready to stop losing leads to the competition?,"Marketing for professional services | Traffic that converts | Real phones ringing | Numbers, not fluff | Sharper positioning first | Case studies as the flywheel | Ads that support sales | Google Ads | SEO | Web Design | Social Media Marketing",Services | Industries | Locations,,
https://leadweb-vert.vercel.app/industries/digital-marketing-for-real-estates/,Digital Marketing for Real Estate | Leadweb Marketing,53,"SEO, paid ads and vendor-focused marketing for real estate agencies in Sydney and nationwide.",93,https://www.leadweb.com.au/industries/digital-marketing-for-real-estates/,digital marketing for real estate businesses,Digital marketing for real estate that wins listings.,What we do differently for real estate | Why real estate choose Leadweb | The playbook | Channels we run for real estate | Recent work | Ready to stop losing leads to the competition?,"Marketing for real estate | Traffic that converts | Real phones ringing | Numbers, not fluff | Appraisal funnels per suburb | Own the 'sold' terms | Agent-led content | Google Ads | SEO | Web Design | Social Media Marketing",Services | Industries | Locations,,
https://leadweb-vert.vercel.app/industries/digital-marketing-for-restaurant/,Digital Marketing for Restaurants and Cafes | Leadweb Marketing,63,"Local SEO, Meta ads and Google Business Profile management for restaurants, cafes and hospitality venues.",105,https://www.leadweb.com.au/industries/digital-marketing-for-restaurant/,digital marketing for restaurants and cafes,Marketing for restaurants that fills tables — mid-week included.,What we do differently for restaurants & hospitality | Why restaurants & hospitality choose Leadweb | The playbook | Channels we run for restaurants & hospitality | Recent work | Ready to stop losing leads to the competition?,"Marketing for restaurants & hospitality | Traffic that converts | Real phones ringing | Numbers, not fluff | Own the map pack | Fill the quiet nights | Events + specials as content | Google Ads | SEO | Web Design | Social Media Marketing",Services | Industries | Locations,,
https://leadweb-vert.vercel.app/industries/digital-marketing-for-small-businesses/,Digital Marketing for Small Business Sydney | Leadweb Marketing,63,"Marketing built for owner-operators. Sharp scope, no fluff retainers, results measured in booked jobs and revenue.",114,https://www.leadweb.com.au/industries/digital-marketing-for-small-businesses/,digital marketing for small businesses,Digital marketing for owner-operated small businesses.,What we do differently for small business | Why small business choose Leadweb | The playbook | Channels we run for small business | Recent work | Ready to stop losing leads to the competition?,"Marketing for small business | Traffic that converts | Real phones ringing | Numbers, not fluff | Pick the right first channel | Ship in weeks, not quarters | Owner-friendly reporting | Google Ads | SEO | Web Design | Social Media Marketing",Services | Industries | Locations,,
https://leadweb-vert.vercel.app/industries/digital-marketing-for-beauty-skincare/,Digital Marketing for Beauty & Skincare | Leadweb Marketing,59,"SEO, paid social and content for beauty clinics, salons and DTC skincare brands. Bookings and DTC revenue, measured properly.",125,https://www.leadweb.com.au/industries/digital-marketing-for-beauty-skincare/,digital marketing for beauty clinics,"Marketing for beauty clinics, salons and skincare brands.",What we do differently for beauty & skincare | Why beauty & skincare choose Leadweb | The playbook | Channels we run for beauty & skincare | Recent work | Ready to stop losing leads to the competition?,"Marketing for beauty & skincare | Traffic that converts | Real phones ringing | Numbers, not fluff | Treatment pages that book | Content native to the platform | Retention as growth | Google Ads | SEO | Web Design | Social Media Marketing",Services | Industries | Locations,,
https://leadweb-vert.vercel.app/location/,Google Ads Agency Serviced Cities — Leadweb Marketing,53,"Leadweb runs Google Ads accounts for owners across Sydney, Melbourne, Brisbane, Perth and Adelaide.",99,https://www.leadweb.com.au/location/,Leadweb Marketing service areas,Nationwide capability. Local accountability.,Google Ads by city | Digital Marketing by city | SEO by city | Lead Generation by city | Pay Per Lead by city | Ready to stop losing leads to the competition?,Google Ads · Sydney | Google Ads · Melbourne | Google Ads · Brisbane | Google Ads · Perth | Google Ads · Adelaide | Digital Marketing · Sydney | Digital Marketing · Melbourne | Digital Marketing · Brisbane | Digital Marketing · Perth | Digital Marketing · Adelaide | SEO · Sydney | SEO · Melbourne | SEO · Brisbane | SEO · Perth | SEO · Adelaide | Lead Generation · Sydney | Lead Generation · Melbourne | Lead Generation · Brisbane | Lead Generation · Perth | Lead Generation · Adelaide | Pay Per Lead · Sydney | Pay Per Lead · Melbourne | Pay Per Lead · Brisbane | Pay Per Lead · Perth | Pay Per Lead · Adelaide,Services | Industries | Locations,,
https://leadweb-vert.vercel.app/google-ads-agency-sydney/,Google Ads Agency Sydney | Leadweb Marketing,44,"Sydney Google Ads management with weekly optimisation, transparent reporting and no lock-in contracts.",102,https://www.leadweb.com.au/google-ads-agency-sydney/,google ads agency sydney,Google Ads agency in Sydney for owners who are done overpaying for leads.,"Why Sydney owners work with us | Every service, run for Sydney businesses | Serving all of Sydney | Recent work | Ready to stop losing leads to the competition?",Google Ads — Sydney | Google Ads | SEO | Web Design | Social Media Marketing | Pay Per Lead | Rent a Website,Services | Industries | Locations,,
https://leadweb-vert.vercel.app/google-ads-agency-melbourne/,Google Ads Agency Melbourne | Leadweb Marketing,47,"Melbourne Google Ads management with weekly optimisation, transparent reporting and no lock-in contracts.",105,https://www.leadweb.com.au/google-ads-agency-melbourne/,google ads agency melbourne,Google Ads agency in Melbourne for owners who are done overpaying for leads.,"Why Melbourne owners work with us | Every service, run for Melbourne businesses | Serving all of Melbourne | Recent work | Ready to stop losing leads to the competition?",Google Ads — Melbourne | Google Ads | SEO | Web Design | Social Media Marketing | Pay Per Lead | Rent a Website,Services | Industries | Locations,,
https://leadweb-vert.vercel.app/google-ads-agency-brisbane/,Google Ads Agency Brisbane | Leadweb Marketing,46,"Brisbane Google Ads management with weekly optimisation, transparent reporting and no lock-in contracts.",104,https://www.leadweb.com.au/google-ads-agency-brisbane/,google ads agency brisbane,Google Ads agency in Brisbane for owners who are done overpaying for leads.,"Why Brisbane owners work with us | Every service, run for Brisbane businesses | Serving all of Brisbane | Recent work | Ready to stop losing leads to the competition?",Google Ads — Brisbane | Google Ads | SEO | Web Design | Social Media Marketing | Pay Per Lead | Rent a Website,Services | Industries | Locations,,
https://leadweb-vert.vercel.app/google-ads-agency-perth/,Google Ads Agency Perth | Leadweb Marketing,43,"Perth Google Ads management with weekly optimisation, transparent reporting and no lock-in contracts.",101,https://www.leadweb.com.au/google-ads-agency-perth/,google ads agency perth,Google Ads agency in Perth for owners who are done overpaying for leads.,"Why Perth owners work with us | Every service, run for Perth businesses | Serving all of Perth | Recent work | Ready to stop losing leads to the competition?",Google Ads — Perth | Google Ads | SEO | Web Design | Social Media Marketing | Pay Per Lead | Rent a Website,Services | Industries | Locations,,
https://leadweb-vert.vercel.app/google-ads-agency-adelaide/,Google Ads Agency Adelaide | Leadweb Marketing,46,"Adelaide Google Ads management with weekly optimisation, transparent reporting and no lock-in contracts.",104,https://www.leadweb.com.au/google-ads-agency-adelaide/,google ads agency adelaide,Google Ads agency in Adelaide for owners who are done overpaying for leads.,"Why Adelaide owners work with us | Every service, run for Adelaide businesses | Serving all of Adelaide | Recent work | Ready to stop losing leads to the competition?",Google Ads — Adelaide | Google Ads | SEO | Web Design | Social Media Marketing | Pay Per Lead | Rent a Website,Services | Industries | Locations,,
https://leadweb-vert.vercel.app/google-ads-agency-parramatta/,Google Ads Agency Parramatta | Leadweb Marketing,48,"Parramatta Google Ads management with weekly optimisation, transparent reporting and no lock-in contracts.",106,https://www.leadweb.com.au/google-ads-agency-parramatta/,google ads agency parramatta,Google Ads agency in Parramatta for owners who are done overpaying for leads.,"Why Parramatta owners work with us | What you actually get | Every service, run for Parramatta businesses | Serving all of Parramatta | Recent work | Ready to stop losing leads to the competition?",Google Ads — Parramatta | Google Ads | SEO | Web Design | Social Media Marketing | Pay Per Lead | Rent a Website,Services | Industries | Locations,,
https://leadweb-vert.vercel.app/google-ads-agency-blacktown/,Google Ads Agency Blacktown | Leadweb Marketing,47,"Blacktown Google Ads management with weekly optimisation, transparent reporting and no lock-in contracts.",105,https://www.leadweb.com.au/google-ads-agency-blacktown/,google ads agency blacktown,Google Ads agency in Blacktown for owners who are done overpaying for leads.,"Why Blacktown owners work with us | What you actually get | Every service, run for Blacktown businesses | Serving all of Blacktown | Recent work | Ready to stop losing leads to the competition?",Google Ads — Blacktown | Google Ads | SEO | Web Design | Social Media Marketing | Pay Per Lead | Rent a Website,Services | Industries | Locations,,
