URL,Meta Title,Title Length,Meta Description,Meta Description Length,Canonical,,Paragraph,H2,H3,H4,H5,H6
https://leadweb-vert.vercel.app/seo-agency-bankstown/,SEO Agency Bankstown | Leadweb Marketing,40,"Bankstown SEO agency ranking service businesses on revenue-moving terms. Technical, on-page, content and local pack — all in-house.",131,https://www.leadweb.com.au/seo-agency-bankstown/,seo agency bankstown,SEO agency in Bankstown for owners who want rankings tied to revenue.,"Why Bankstown owners work with us | What you actually get | Every service, run for Bankstown businesses | Serving all of Bankstown | Recent work | Ready to stop losing leads to the competition?",SEO — Bankstown | Google Ads | SEO | Web Design | Social Media Marketing | Pay Per Lead | Rent a Website,Services | Industries | Locations,,
https://leadweb-vert.vercel.app/seo-agency-campbelltown/,SEO Agency Campbelltown | Leadweb Marketing,43,"Campbelltown SEO agency ranking service businesses on revenue-moving terms. Technical, on-page, content and local pack — all in-house.",134,https://www.leadweb.com.au/seo-agency-campbelltown/,seo agency campbelltown,SEO agency in Campbelltown for owners who want rankings tied to revenue.,"Why Campbelltown owners work with us | What you actually get | Every service, run for Campbelltown businesses | Serving all of Campbelltown | Recent work | Ready to stop losing leads to the competition?",SEO — Campbelltown | Google Ads | SEO | Web Design | Social Media Marketing | Pay Per Lead | Rent a Website,Services | Industries | Locations,,
https://leadweb-vert.vercel.app/seo-agency-wollongong/,SEO Agency Wollongong | Leadweb Marketing,41,"Wollongong SEO agency ranking service businesses on revenue-moving terms. Technical, on-page, content and local pack — all in-house.",132,https://www.leadweb.com.au/seo-agency-wollongong/,seo agency wollongong,SEO agency in Wollongong for owners who want rankings tied to revenue.,"Why Wollongong owners work with us | What you actually get | Every service, run for Wollongong businesses | Serving all of Wollongong | Recent work | Ready to stop losing leads to the competition?",SEO — Wollongong | Google Ads | SEO | Web Design | Social Media Marketing | Pay Per Lead | Rent a Website,Services | Industries | Locations,,
https://leadweb-vert.vercel.app/seo-agency-newcastle/,SEO Agency Newcastle | Leadweb Marketing,40,"Newcastle SEO agency ranking service businesses on revenue-moving terms. Technical, on-page, content and local pack — all in-house.",131,https://www.leadweb.com.au/seo-agency-newcastle/,seo agency new castle,SEO agency in Newcastle for owners who want rankings tied to revenue.,"Why Newcastle owners work with us | What you actually get | Every service, run for Newcastle businesses | Serving all of Newcastle | Recent work | Ready to stop losing leads to the competition?",SEO — Newcastle | Google Ads | SEO | Web Design | Social Media Marketing | Pay Per Lead | Rent a Website,Services | Industries | Locations,,
https://leadweb-vert.vercel.app/seo-agency-chatswood/,SEO Agency Chatswood | Leadweb Marketing,40,"Chatswood SEO agency ranking service businesses on revenue-moving terms. Technical, on-page, content and local pack — all in-house.",131,https://www.leadweb.com.au/seo-agency-chatswood/,seo agency chatswood,SEO agency in Chatswood for owners who want rankings tied to revenue.,"Why Chatswood owners work with us | What you actually get | Every service, run for Chatswood businesses | Serving all of Chatswood | Recent work | Ready to stop losing leads to the competition?",SEO — Chatswood | Google Ads | SEO | Web Design | Social Media Marketing | Pay Per Lead | Rent a Website,Services | Industries | Locations,,
https://leadweb-vert.vercel.app/seo-agency-burwood/,SEO Agency Burwood | Leadweb Marketing,38,"Burwood SEO agency ranking service businesses on revenue-moving terms. Technical, on-page, content and local pack — all in-house.",129,https://www.leadweb.com.au/seo-agency-burwood/,seo agency burwood,SEO agency in Burwood for owners who want rankings tied to revenue.,"Why Burwood owners work with us | What you actually get | Every service, run for Burwood businesses | Serving all of Burwood | Recent work | Ready to stop losing leads to the competition?",SEO — Burwood | Google Ads | SEO | Web Design | Social Media Marketing | Pay Per Lead | Rent a Website,Services | Industries | Locations,,
https://leadweb-vert.vercel.app/seo-agency-balmain/,SEO Agency Balmain | Leadweb Marketing,38,"Balmain SEO agency ranking service businesses on revenue-moving terms. Technical, on-page, content and local pack — all in-house.",129,https://www.leadweb.com.au/seo-agency-balmain/,seo agency balmain,SEO agency in Balmain for owners who want rankings tied to revenue.,"Why Balmain owners work with us | What you actually get | Every service, run for Balmain businesses | Serving all of Balmain | Recent work | Ready to stop losing leads to the competition?",SEO — Balmain | Google Ads | SEO | Web Design | Social Media Marketing | Pay Per Lead | Rent a Website,Services | Industries | Locations,,
https://leadweb-vert.vercel.app/seo-agency-bondi/,SEO Agency Bondi | Leadweb Marketing,36,"Bondi SEO agency ranking service businesses on revenue-moving terms. Technical, on-page, content and local pack — all in-house.",127,https://www.leadweb.com.au/seo-agency-bondi/,seo agency bondi,SEO agency in Bondi for owners who want rankings tied to revenue.,"Why Bondi owners work with us | What you actually get | Every service, run for Bondi businesses | Serving all of Bondi | Recent work | Ready to stop losing leads to the competition?",SEO — Bondi | Google Ads | SEO | Web Design | Social Media Marketing | Pay Per Lead | Rent a Website,Services | Industries | Locations,,
https://leadweb-vert.vercel.app/seo-agency-double-bay/,SEO Agency Double Bay | Leadweb Marketing,41,"Double Bay SEO agency ranking service businesses on revenue-moving terms. Technical, on-page, content and local pack — all in-house.",132,https://www.leadweb.com.au/seo-agency-double-bay/,seo agency double bay,SEO agency in Double Bay for owners who want rankings tied to revenue.,"Why Double Bay owners work with us | What you actually get | Every service, run for Double Bay businesses | Serving all of Double Bay | Recent work | Ready to stop losing leads to the competition?",SEO — Double Bay | Google Ads | SEO | Web Design | Social Media Marketing | Pay Per Lead | Rent a Website,Services | Industries | Locations,,
https://leadweb-vert.vercel.app/lead-generation-agency-sydney/,Lead Generation Agency Sydney | Leadweb Marketing,49,"Sydney lead generation agency. Paid, SEO, landing pages and call tracking engineered to book qualified jobs — not clicks.",121,https://www.leadweb.com.au/lead-generation-agency-sydney/,lead generation agency sydney,Lead generation for Sydney businesses — measured in booked jobs.,"Why Sydney owners work with us | Every service, run for Sydney businesses | Serving all of Sydney | Recent work | Ready to stop losing leads to the competition?",Lead Generation — Sydney | Google Ads | SEO | Web Design | Social Media Marketing | Pay Per Lead | Rent a Website,Services | Industries | Locations,,
https://leadweb-vert.vercel.app/lead-generation-agency-melbourne/,Lead Generation Agency Melbourne | Leadweb Marketing,52,"Melbourne lead generation agency. Paid, SEO, landing pages and call tracking engineered to book qualified jobs — not clicks.",124,https://www.leadweb.com.au/lead-generation-agency-melbourne/,lead generation agency melbourne,Lead generation for Melbourne businesses — measured in booked jobs.,"Why Melbourne owners work with us | Every service, run for Melbourne businesses | Serving all of Melbourne | Recent work | Ready to stop losing leads to the competition?",Lead Generation — Melbourne | Google Ads | SEO | Web Design | Social Media Marketing | Pay Per Lead | Rent a Website,Services | Industries | Locations,,
https://leadweb-vert.vercel.app/lead-generation-agency-brisbane/,Lead Generation Agency Brisbane | Leadweb Marketing,51,"Brisbane lead generation agency. Paid, SEO, landing pages and call tracking engineered to book qualified jobs — not clicks.",123,https://www.leadweb.com.au/lead-generation-agency-brisbane/,lead generation agency brisbane,Lead generation for Brisbane businesses — measured in booked jobs.,"Why Brisbane owners work with us | Every service, run for Brisbane businesses | Serving all of Brisbane | Recent work | Ready to stop losing leads to the competition?",Lead Generation — Brisbane | Google Ads | SEO | Web Design | Social Media Marketing | Pay Per Lead | Rent a Website,Services | Industries | Locations,,
https://leadweb-vert.vercel.app/lead-generation-agency-perth/,Lead Generation Agency Perth | Leadweb Marketing,48,"Perth lead generation agency. Paid, SEO, landing pages and call tracking engineered to book qualified jobs — not clicks.",120,https://www.leadweb.com.au/lead-generation-agency-perth/,lead generation agency perth,Lead generation for Perth businesses — measured in booked jobs.,"Why Perth owners work with us | Every service, run for Perth businesses | Serving all of Perth | Recent work | Ready to stop losing leads to the competition?",Lead Generation — Perth | Google Ads | SEO | Web Design | Social Media Marketing | Pay Per Lead | Rent a Website,Services | Industries | Locations,,
https://leadweb-vert.vercel.app/lead-generation-agency-adelaide/,Lead Generation Agency Adelaide | Leadweb Marketing,51,"Adelaide lead generation agency. Paid, SEO, landing pages and call tracking engineered to book qualified jobs — not clicks.",123,https://www.leadweb.com.au/lead-generation-agency-adelaide/,lead generation agency adelaide,Lead generation for Adelaide businesses — measured in booked jobs.,"Why Adelaide owners work with us | Every service, run for Adelaide businesses | Serving all of Adelaide | Recent work | Ready to stop losing leads to the competition?",Lead Generation — Adelaide | Google Ads | SEO | Web Design | Social Media Marketing | Pay Per Lead | Rent a Website,Services | Industries | Locations,,
https://leadweb-vert.vercel.app/lead-generation-agency-parramatta/,Lead Generation Agency Parramatta | Leadweb Marketing,53,"Parramatta lead generation agency. Paid, SEO, landing pages and call tracking engineered to book qualified jobs — not clicks.",125,https://www.leadweb.com.au/lead-generation-agency-parramatta/,lead generation agency parramatta,Lead generation for Parramatta businesses — measured in booked jobs.,"Why Parramatta owners work with us | What you actually get | Every service, run for Parramatta businesses | Serving all of Parramatta | Recent work | Ready to stop losing leads to the competition?",Lead Generation — Parramatta | Google Ads | SEO | Web Design | Social Media Marketing | Pay Per Lead | Rent a Website,Services | Industries | Locations,,
https://leadweb-vert.vercel.app/lead-generation-agency-blacktown/,Lead Generation Agency Blacktown | Leadweb Marketing,52,"Blacktown lead generation agency. Paid, SEO, landing pages and call tracking engineered to book qualified jobs — not clicks.",124,https://www.leadweb.com.au/lead-generation-agency-blacktown/,lead generation agency blacktown,Lead generation for Blacktown businesses — measured in booked jobs.,"Why Blacktown owners work with us | What you actually get | Every service, run for Blacktown businesses | Serving all of Blacktown | Recent work | Ready to stop losing leads to the competition?",Lead Generation — Blacktown | Google Ads | SEO | Web Design | Social Media Marketing | Pay Per Lead | Rent a Website,Services | Industries | Locations,,
https://leadweb-vert.vercel.app/lead-generation-agency-penrith/,Lead Generation Agency Penrith | Leadweb Marketing,50,"Penrith lead generation agency. Paid, SEO, landing pages and call tracking engineered to book qualified jobs — not clicks.",122,https://www.leadweb.com.au/lead-generation-agency-penrith/,lead generation agency penrith,Lead generation for Penrith businesses — measured in booked jobs.,"Why Penrith owners work with us | What you actually get | Every service, run for Penrith businesses | Serving all of Penrith | Recent work | Ready to stop losing leads to the competition?",Lead Generation — Penrith | Google Ads | SEO | Web Design | Social Media Marketing | Pay Per Lead | Rent a Website,Services | Industries | Locations,,
https://leadweb-vert.vercel.app/lead-generation-agency-bankstown/,Lead Generation Agency Bankstown | Leadweb Marketing,52,"Bankstown lead generation agency. Paid, SEO, landing pages and call tracking engineered to book qualified jobs — not clicks.",124,https://www.leadweb.com.au/lead-generation-agency-bankstown/,lead generation agency bankstown,Lead generation for Bankstown businesses — measured in booked jobs.,"Why Bankstown owners work with us | What you actually get | Every service, run for Bankstown businesses | Serving all of Bankstown | Recent work | Ready to stop losing leads to the competition?",Lead Generation — Bankstown | Google Ads | SEO | Web Design | Social Media Marketing | Pay Per Lead | Rent a Website,Services | Industries | Locations,,
https://leadweb-vert.vercel.app/lead-generation-agency-campbelltown/,Lead Generation Agency Campbelltown | Leadweb Marketing,55,"Campbelltown lead generation agency. Paid, SEO, landing pages and call tracking engineered to book qualified jobs — not clicks.",127,https://www.leadweb.com.au/lead-generation-agency-campbelltown/,lead generation agency campbelltown,Lead generation for Campbelltown businesses — measured in booked jobs.,"Why Campbelltown owners work with us | What you actually get | Every service, run for Campbelltown businesses | Serving all of Campbelltown | Recent work | Ready to stop losing leads to the competition?",Lead Generation — Campbelltown | Google Ads | SEO | Web Design | Social Media Marketing | Pay Per Lead | Rent a Website,Services | Industries | Locations,,
https://leadweb-vert.vercel.app/lead-generation-agency-wollongong/,Lead Generation Agency Wollongong | Leadweb Marketing,53,"Wollongong lead generation agency. Paid, SEO, landing pages and call tracking engineered to book qualified jobs — not clicks.",125,https://www.leadweb.com.au/lead-generation-agency-wollongong/,lead generation agency wollongong,Lead generation for Wollongong businesses — measured in booked jobs.,"Why Wollongong owners work with us | What you actually get | Every service, run for Wollongong businesses | Serving all of Wollongong | Recent work | Ready to stop losing leads to the competition?",Lead Generation — Wollongong | Google Ads | SEO | Web Design | Social Media Marketing | Pay Per Lead | Rent a Website,Services | Industries | Locations,,
https://leadweb-vert.vercel.app/lead-generation-agency-newcastle/,Lead Generation Agency Newcastle | Leadweb Marketing,52,"Newcastle lead generation agency. Paid, SEO, landing pages and call tracking engineered to book qualified jobs — not clicks.",124,https://www.leadweb.com.au/lead-generation-agency-newcastle/,lead generation agency new castle,Lead generation for Newcastle businesses — measured in booked jobs.,"Why Newcastle owners work with us | What you actually get | Every service, run for Newcastle businesses | Serving all of Newcastle | Recent work | Ready to stop losing leads to the competition?",Lead Generation — Newcastle | Google Ads | SEO | Web Design | Social Media Marketing | Pay Per Lead | Rent a Website,Services | Industries | Locations,,
https://leadweb-vert.vercel.app/lead-generation-agency-chatswood/,Lead Generation Agency Chatswood | Leadweb Marketing,52,"Chatswood lead generation agency. Paid, SEO, landing pages and call tracking engineered to book qualified jobs — not clicks.",124,https://www.leadweb.com.au/lead-generation-agency-chatswood/,lead generation agency chatswood,Lead generation for Chatswood businesses — measured in booked jobs.,"Why Chatswood owners work with us | What you actually get | Every service, run for Chatswood businesses | Serving all of Chatswood | Recent work | Ready to stop losing leads to the competition?",Lead Generation — Chatswood | Google Ads | SEO | Web Design | Social Media Marketing | Pay Per Lead | Rent a Website,Services | Industries | Locations,,
https://leadweb-vert.vercel.app/lead-generation-agency-burwood/,Lead Generation Agency Burwood | Leadweb Marketing,50,"Burwood lead generation agency. Paid, SEO, landing pages and call tracking engineered to book qualified jobs — not clicks.",122,https://www.leadweb.com.au/lead-generation-agency-burwood/,lead generation agency burwood,Lead generation for Burwood businesses — measured in booked jobs.,"Why Burwood owners work with us | What you actually get | Every service, run for Burwood businesses | Serving all of Burwood | Recent work | Ready to stop losing leads to the competition?",Lead Generation — Burwood | Google Ads | SEO | Web Design | Social Media Marketing | Pay Per Lead | Rent a Website,Services | Industries | Locations,,
https://leadweb-vert.vercel.app/lead-generation-agency-balmain/,Lead Generation Agency Balmain | Leadweb Marketing,50,"Balmain lead generation agency. Paid, SEO, landing pages and call tracking engineered to book qualified jobs — not clicks.",122,https://www.leadweb.com.au/lead-generation-agency-balmain/,lead generation agency balmain,Lead generation for Balmain businesses — measured in booked jobs.,"Why Balmain owners work with us | What you actually get | Every service, run for Balmain businesses | Serving all of Balmain | Recent work | Ready to stop losing leads to the competition?",Lead Generation — Balmain | Google Ads | SEO | Web Design | Social Media Marketing | Pay Per Lead | Rent a Website,Services | Industries | Locations,,
https://leadweb-vert.vercel.app/lead-generation-agency-bondi/,Lead Generation Agency Bondi | Leadweb Marketing,48,"Bondi lead generation agency. Paid, SEO, landing pages and call tracking engineered to book qualified jobs — not clicks.",120,https://www.leadweb.com.au/lead-generation-agency-bondi/,lead generation agency bondi,Lead generation for Bondi businesses — measured in booked jobs.,"Why Bondi owners work with us | What you actually get | Every service, run for Bondi businesses | Serving all of Bondi | Recent work | Ready to stop losing leads to the competition?",Lead Generation — Bondi | Google Ads | SEO | Web Design | Social Media Marketing | Pay Per Lead | Rent a Website,Services | Industries | Locations,,
https://leadweb-vert.vercel.app/lead-generation-agency-double-bay/,Lead Generation Agency Double Bay | Leadweb Marketing,53,"Double Bay lead generation agency. Paid, SEO, landing pages and call tracking engineered to book qualified jobs — not clicks.",125,https://www.leadweb.com.au/lead-generation-agency-double-bay/,lead generation agency double bay,Lead generation for Double Bay businesses — measured in booked jobs.,"Why Double Bay owners work with us | What you actually get | Every service, run for Double Bay businesses | Serving all of Double Bay | Recent work | Ready to stop losing leads to the competition?",Lead Generation — Double Bay | Google Ads | SEO | Web Design | Social Media Marketing | Pay Per Lead | Rent a Website,Services | Industries | Locations,,
https://leadweb-vert.vercel.app/pay-per-lead-sydney/,Pay Per Lead Sydney | Leadweb Marketing,39,"Pay Per Lead in Sydney. Exclusive, qualified leads delivered in real time. You only pay for the leads, not the process.",119,https://www.leadweb.com.au/pay-per-lead-sydney/,pay per lead sydney,Pay Per Lead in Sydney. Only pay for the leads — not the process to get them.,"Why Sydney owners work with us | Every service, run for Sydney businesses | Serving all of Sydney | Recent work | Ready to stop losing leads to the competition?",Pay Per Lead — Sydney | Google Ads | SEO | Web Design | Social Media Marketing | Pay Per Lead | Rent a Website,Services | Industries | Locations,,
https://leadweb-vert.vercel.app/pay-per-lead-melbourne/,Pay Per Lead Melbourne | Leadweb Marketing,42,"Pay Per Lead in Melbourne. Exclusive, qualified leads delivered in real time. You only pay for the leads, not the process.",122,https://www.leadweb.com.au/pay-per-lead-melbourne/,pay per lead melbourne,Pay Per Lead in Melbourne. Only pay for the leads — not the process to get them.,"Why Melbourne owners work with us | Every service, run for Melbourne businesses | Serving all of Melbourne | Recent work | Ready to stop losing leads to the competition?",Pay Per Lead — Melbourne | Google Ads | SEO | Web Design | Social Media Marketing | Pay Per Lead | Rent a Website,Services | Industries | Locations,,
https://leadweb-vert.vercel.app/pay-per-lead-brisbane/,Pay Per Lead Brisbane | Leadweb Marketing,41,"Pay Per Lead in Brisbane. Exclusive, qualified leads delivered in real time. You only pay for the leads, not the process.",121,https://www.leadweb.com.au/pay-per-lead-brisbane/,pay per lead brisbane,Pay Per Lead in Brisbane. Only pay for the leads — not the process to get them.,"Why Brisbane owners work with us | Every service, run for Brisbane businesses | Serving all of Brisbane | Recent work | Ready to stop losing leads to the competition?",Pay Per Lead — Brisbane | Google Ads | SEO | Web Design | Social Media Marketing | Pay Per Lead | Rent a Website,Services | Industries | Locations,,
https://leadweb-vert.vercel.app/pay-per-lead-perth/,Pay Per Lead Perth | Leadweb Marketing,38,"Pay Per Lead in Perth. Exclusive, qualified leads delivered in real time. You only pay for the leads, not the process.",118,https://www.leadweb.com.au/pay-per-lead-perth/,pay per lead perth,Pay Per Lead in Perth. Only pay for the leads — not the process to get them.,"Why Perth owners work with us | Every service, run for Perth businesses | Serving all of Perth | Recent work | Ready to stop losing leads to the competition?",Pay Per Lead — Perth | Google Ads | SEO | Web Design | Social Media Marketing | Pay Per Lead | Rent a Website,Services | Industries | Locations,,
https://leadweb-vert.vercel.app/pay-per-lead-adelaide/,Pay Per Lead Adelaide | Leadweb Marketing,41,"Pay Per Lead in Adelaide. Exclusive, qualified leads delivered in real time. You only pay for the leads, not the process.",121,https://www.leadweb.com.au/pay-per-lead-adelaide/,pay per lead adelaide,Pay Per Lead in Adelaide. Only pay for the leads — not the process to get them.,"Why Adelaide owners work with us | Every service, run for Adelaide businesses | Serving all of Adelaide | Recent work | Ready to stop losing leads to the competition?",Pay Per Lead — Adelaide | Google Ads | SEO | Web Design | Social Media Marketing | Pay Per Lead | Rent a Website,Services | Industries | Locations,,
https://leadweb-vert.vercel.app/pay-per-lead-parramatta/,Pay Per Lead Parramatta | Leadweb Marketing,43,"Pay Per Lead in Parramatta. Exclusive, qualified leads delivered in real time. You only pay for the leads, not the process.",123,https://www.leadweb.com.au/pay-per-lead-parramatta/,pay per lead parramatta,Pay Per Lead in Parramatta. Only pay for the leads — not the process to get them.,"Why Parramatta owners work with us | What you actually get | Every service, run for Parramatta businesses | Serving all of Parramatta | Recent work | Ready to stop losing leads to the competition?",Pay Per Lead — Parramatta | Google Ads | SEO | Web Design | Social Media Marketing | Pay Per Lead | Rent a Website,Services | Industries | Locations,,
https://leadweb-vert.vercel.app/pay-per-lead-blacktown/,Pay Per Lead Blacktown | Leadweb Marketing,42,"Pay Per Lead in Blacktown. Exclusive, qualified leads delivered in real time. You only pay for the leads, not the process.",122,https://www.leadweb.com.au/pay-per-lead-blacktown/,pay per lead blacktown,Pay Per Lead in Blacktown. Only pay for the leads — not the process to get them.,"Why Blacktown owners work with us | What you actually get | Every service, run for Blacktown businesses | Serving all of Blacktown | Recent work | Ready to stop losing leads to the competition?",Pay Per Lead — Blacktown | Google Ads | SEO | Web Design | Social Media Marketing | Pay Per Lead | Rent a Website,Services | Industries | Locations,,
https://leadweb-vert.vercel.app/pay-per-lead-penrith/,Pay Per Lead Penrith | Leadweb Marketing,40,"Pay Per Lead in Penrith. Exclusive, qualified leads delivered in real time. You only pay for the leads, not the process.",120,https://www.leadweb.com.au/pay-per-lead-penrith/,pay per lead penrith,Pay Per Lead in Penrith. Only pay for the leads — not the process to get them.,"Why Penrith owners work with us | What you actually get | Every service, run for Penrith businesses | Serving all of Penrith | Recent work | Ready to stop losing leads to the competition?",Pay Per Lead — Penrith | Google Ads | SEO | Web Design | Social Media Marketing | Pay Per Lead | Rent a Website,Services | Industries | Locations,,
https://leadweb-vert.vercel.app/pay-per-lead-bankstown/,Pay Per Lead Bankstown | Leadweb Marketing,42,"Pay Per Lead in Bankstown. Exclusive, qualified leads delivered in real time. You only pay for the leads, not the process.",122,https://www.leadweb.com.au/pay-per-lead-bankstown/,pay per lead bankstown,Pay Per Lead in Bankstown. Only pay for the leads — not the process to get them.,"Why Bankstown owners work with us | What you actually get | Every service, run for Bankstown businesses | Serving all of Bankstown | Recent work | Ready to stop losing leads to the competition?",Pay Per Lead — Bankstown | Google Ads | SEO | Web Design | Social Media Marketing | Pay Per Lead | Rent a Website,Services | Industries | Locations,,
