URL,Meta Title,Title Length,Meta Description,Meta Description Length,Canonical,,Paragraph,H2,H3,H4,H5,H6
https://leadweb-vert.vercel.app/pay-per-lead-campbelltown/,Pay Per Lead Campbelltown | Leadweb Marketing,45,"Pay Per Lead in Campbelltown. Exclusive, qualified leads delivered in real time. You only pay for the leads, not the process.",125,https://www.leadweb.com.au/pay-per-lead-campbelltown/,pay per lead campbelltown,Pay Per Lead in Campbelltown. Only pay for the leads — not the process to get them.,"Why Campbelltown owners work with us | What you actually get | Every service, run for Campbelltown businesses | Serving all of Campbelltown | Recent work | Ready to stop losing leads to the competition?",Pay Per Lead — Campbelltown | Google Ads | SEO | Web Design | Social Media Marketing | Pay Per Lead | Rent a Website,Services | Industries | Locations,,
https://leadweb-vert.vercel.app/pay-per-lead-wollongong/,Pay Per Lead Wollongong | Leadweb Marketing,43,"Pay Per Lead in Wollongong. Exclusive, qualified leads delivered in real time. You only pay for the leads, not the process.",123,https://www.leadweb.com.au/pay-per-lead-wollongong/,pay per lead wollongong,Pay Per Lead in Wollongong. Only pay for the leads — not the process to get them.,"Why Wollongong owners work with us | What you actually get | Every service, run for Wollongong businesses | Serving all of Wollongong | Recent work | Ready to stop losing leads to the competition?",Pay Per Lead — Wollongong | Google Ads | SEO | Web Design | Social Media Marketing | Pay Per Lead | Rent a Website,Services | Industries | Locations,,
https://leadweb-vert.vercel.app/pay-per-lead-newcastle/,Pay Per Lead Newcastle | Leadweb Marketing,42,"Pay Per Lead in Newcastle. Exclusive, qualified leads delivered in real time. You only pay for the leads, not the process.",122,https://www.leadweb.com.au/pay-per-lead-newcastle/,pay per lead new castle,Pay Per Lead in Newcastle. Only pay for the leads — not the process to get them.,"Why Newcastle owners work with us | What you actually get | Every service, run for Newcastle businesses | Serving all of Newcastle | Recent work | Ready to stop losing leads to the competition?",Pay Per Lead — Newcastle | Google Ads | SEO | Web Design | Social Media Marketing | Pay Per Lead | Rent a Website,Services | Industries | Locations,,
https://leadweb-vert.vercel.app/pay-per-lead-chatswood/,Pay Per Lead Chatswood | Leadweb Marketing,42,"Pay Per Lead in Chatswood. Exclusive, qualified leads delivered in real time. You only pay for the leads, not the process.",122,https://www.leadweb.com.au/pay-per-lead-chatswood/,pay per lead chatswood,Pay Per Lead in Chatswood. Only pay for the leads — not the process to get them.,"Why Chatswood owners work with us | What you actually get | Every service, run for Chatswood businesses | Serving all of Chatswood | Recent work | Ready to stop losing leads to the competition?",Pay Per Lead — Chatswood | Google Ads | SEO | Web Design | Social Media Marketing | Pay Per Lead | Rent a Website,Services | Industries | Locations,,
https://leadweb-vert.vercel.app/pay-per-lead-burwood/,Pay Per Lead Burwood | Leadweb Marketing,40,"Pay Per Lead in Burwood. Exclusive, qualified leads delivered in real time. You only pay for the leads, not the process.",120,https://www.leadweb.com.au/pay-per-lead-burwood/,pay per lead burwood,Pay Per Lead in Burwood. Only pay for the leads — not the process to get them.,"Why Burwood owners work with us | What you actually get | Every service, run for Burwood businesses | Serving all of Burwood | Recent work | Ready to stop losing leads to the competition?",Pay Per Lead — Burwood | Google Ads | SEO | Web Design | Social Media Marketing | Pay Per Lead | Rent a Website,Services | Industries | Locations,,
https://leadweb-vert.vercel.app/pay-per-lead-balmain/,Pay Per Lead Balmain | Leadweb Marketing,40,"Pay Per Lead in Balmain. Exclusive, qualified leads delivered in real time. You only pay for the leads, not the process.",120,https://www.leadweb.com.au/pay-per-lead-balmain/,pay per lead balmain,Pay Per Lead in Balmain. Only pay for the leads — not the process to get them.,"Why Balmain owners work with us | What you actually get | Every service, run for Balmain businesses | Serving all of Balmain | Recent work | Ready to stop losing leads to the competition?",Pay Per Lead — Balmain | Google Ads | SEO | Web Design | Social Media Marketing | Pay Per Lead | Rent a Website,Services | Industries | Locations,,
https://leadweb-vert.vercel.app/pay-per-lead-bondi/,Pay Per Lead Bondi | Leadweb Marketing,38,"Pay Per Lead in Bondi. Exclusive, qualified leads delivered in real time. You only pay for the leads, not the process.",118,https://www.leadweb.com.au/pay-per-lead-bondi/,pay per lead bondi,Pay Per Lead in Bondi. Only pay for the leads — not the process to get them.,"Why Bondi owners work with us | What you actually get | Every service, run for Bondi businesses | Serving all of Bondi | Recent work | Ready to stop losing leads to the competition?",Pay Per Lead — Bondi | Google Ads | SEO | Web Design | Social Media Marketing | Pay Per Lead | Rent a Website,Services | Industries | Locations,,
https://leadweb-vert.vercel.app/pay-per-lead-double-bay/,Pay Per Lead Double Bay | Leadweb Marketing,43,"Pay Per Lead in Double Bay. Exclusive, qualified leads delivered in real time. You only pay for the leads, not the process.",123,https://www.leadweb.com.au/pay-per-lead-double-bay/,pay per lead double bay,Pay Per Lead in Double Bay. Only pay for the leads — not the process to get them.,"Why Double Bay owners work with us | What you actually get | Every service, run for Double Bay businesses | Serving all of Double Bay | Recent work | Ready to stop losing leads to the competition?",Pay Per Lead — Double Bay | Google Ads | SEO | Web Design | Social Media Marketing | Pay Per Lead | Rent a Website,Services | Industries | Locations,,
https://leadweb-vert.vercel.app/pay-per-lead-for-tradies/,Pay Per Lead for Tradies Sydney | Leadweb Marketing,51,"Exclusive, real-time leads for electricians, plumbers, builders and trades. You only pay for leads that match your service and postcode.",136,https://www.leadweb.com.au/pay-per-lead-for-tradies/,pay per lead for tradies,Book more jobs without becoming a marketer.,What we cover | Ready to stop losing leads to the competition?,Check availability,Services | Industries | Locations,,
https://leadweb-vert.vercel.app/blog/,"Blog — Lead Generation, Google Ads & SEO Insights | Leadweb Marketing",69,"No-fluff guides on lead generation, pay per lead, Google Ads, SEO and digital marketing for Australian business owners. Written by Basheer Padanna.",147,https://www.leadweb.com.au/blog/,Lead Generation Blog by Leadweb Marketing,Straight-talking growth reads for Australian business owners.,Lead Generation for Australian Businesses in 2026: What Actually Works Now | Latest articles,"Pay Per Lead vs Retainer Agency: Which Model Actually Delivers ROI? | Google Ads for Small Business: Stop Burning Budget on the Wrong Keywords | SEO in 2026: Ranking with AI Overviews, E-E-A-T and Fewer Clicks | The Digital Marketing Strategy That Actually Books Jobs (Not Just Clicks) | Cost Per Lead Benchmarks Across Australian Industries (2026 Data) | Local SEO for Tradies: How to Dominate Your Suburb on Google | Meta Ads for Service Businesses: From Scroll to Booked Call | Growth Marketing vs Digital Marketing: What's the Actual Difference? | Why Your Website Isn't Converting (And the 7 Fixes That Actually Matter)",Services | Industries | Locations,,
https://leadweb-vert.vercel.app/blog/lead-generation-for-australian-businesses/,Lead Generation Australia 2026 — What Actually Works | Leadweb Marketing,72,"A no-fluff guide to lead generation for Australian business owners. Real benchmarks, channel mix, and the moves that separate a $30 lead from a $300 one.",153,https://www.leadweb.com.au/blog/lead-generation-for-australian-businesses/,Lead Generation for Australian Businesses,Lead Generation for Australian Businesses in 2026: What Actually Works Now,Why lead generation feels harder than it used to | What actually changed in the last 24 months | The channel mix that's working right now | The seven questions that decide your lead cost | The 48-minute lead-response rule | What good looks like in 2026 — a target scorecard | Five common mistakes I see almost weekly | Frequently asked owner questions | Where to go next | Keep reading,"Google is now the answer engine, not the directory | Meta became viable again for services | Buyers verify you before they contact you | 1. Google Ads — the fastest way to buy demand | 2. Local SEO — the compounding asset | 3. Pay per lead or rent-a-website for cashflow-sensitive months | 4. Email and SMS to your existing list — the free channel everyone ignores | Not sure which channel to start with? | How long before I see results from a real lead-gen program? | What's a realistic monthly budget to start? | Should I hire in-house or use an agency? | Want a plain-English audit of your current lead flow? | Want the phone ringing?",Services | Industries | Locations,,
https://leadweb-vert.vercel.app/blog/pay-per-lead-vs-retainer/,Pay Per Lead vs Retainer — Which Delivers ROI? | Leadweb Marketing,66,"A CFO-friendly breakdown of pay-per-lead vs monthly retainer agencies. Cost per lead maths, risk profile, and when each model wins.",131,https://www.leadweb.com.au/blog/pay-per-lead-vs-retainer/,Pay Lead Vs Monthly Retainer,Pay Per Lead vs Retainer Agency: Which Model Actually Delivers ROI?,The four numbers that decide it | What a retainer agency actually gives you | What pay per lead actually gives you | The maths every owner should run before signing anything | A simple decision tree | Red flags in either model | The hybrid model most owners never consider | Frequently asked questions | Keep reading,The upside owners underestimate | The downside owners underestimate | Exclusive vs shared — the single most important question to ask | Want me to run these numbers on your business? | What happens if I want to leave a retainer? | Is pay-per-lead the same as buying HiPages leads? | Can I start with pay-per-lead and switch later? | Not sure which model fits your numbers? | Want the phone ringing?,Services | Industries | Locations,,
https://leadweb-vert.vercel.app/blog/google-ads-for-small-business/,Google Ads for Small Business Australia | Leadweb Marketing,59,"How Australian small-business owners can cut their Google Ads spend by 30-50% while getting more booked jobs. Real tactics, no jargon.",134,https://www.leadweb.com.au/blog/google-ads-for-small-business/,Google Ads for Small Business,Google Ads for Small Business: Stop Burning Budget on the Wrong Keywords,Why Google Ads quietly gets worse over time | The three account setups that quietly bleed money | Conversion tracking — the invisible foundation | What a lean small-business account looks like | Landing pages: the multiplier no one wants to build | What good performance looks like in Australia | The 30-day account rescue plan | Frequently asked owner questions | Keep reading,"1. Broad match with no negative keyword list | 2. Search + Display bundled in one campaign | 3. Smart Bidding on a fresh account with no conversion data | 4. Performance Max as the default ""easy"" campaign | Want me to audit your account this week? | Should I use Google's automated recommendations? | How much should I spend? | Do I need an agency or can I run this myself? | Want us to audit your Google Ads account? | Want the phone ringing?",Services | Industries | Locations,,
https://leadweb-vert.vercel.app/blog/seo-in-2026-ai-overviews-and-eeat/,SEO in 2026 — AI Overviews & E-E-A-T Guide | Leadweb Marketing,62,AI Overviews are eating the top of Google. Here's how Australian businesses are still winning organic traffic — and turning it into booked jobs.,144,https://www.leadweb.com.au/blog/seo-in-2026-ai-overviews-and-eeat/,SEO 2026,"SEO in 2026: Ranking with AI Overviews, E-E-A-T and Fewer Clicks",Why commercial SEO actually got easier | The three types of query and how they behave in 2026 | E-E-A-T isn't a buzzword any more — it's a scoring signal | What content actually ranks now | The 2026 technical SEO baseline | Local SEO is now the biggest single lever | What to stop paying for | The 90-day SEO plan we actually run | Frequently asked owner questions | Keep reading,"Informational (""how does…"", ""what is…"", ""why won't…"") | Commercial (""best [service]"", ""[service] near me"", ""[service] [suburb]"") | Navigational (""[your brand]"", ""[competitor] reviews"") | Want a 40-point SEO audit of your site? | Has AI killed the SEO industry? | Should I use AI to write my content? | How long before SEO pays back? | Want to see where your site stands? | Want the phone ringing?",Services | Industries | Locations,,
https://leadweb-vert.vercel.app/blog/digital-marketing-strategy-that-books-jobs/,Digital Marketing Strategy That Books Jobs | Leadweb Marketing,62,A booked-job-first framework for digital marketing. Skip the vanity metrics and build a system that ties every dollar back to revenue.,134,https://www.leadweb.com.au/blog/digital-marketing-strategy-that-books-jobs/,digital marketing that actually book jobs,The Digital Marketing Strategy That Actually Books Jobs (Not Just Clicks),The booked-job-first framework | The five-page marketing plan every owner should have | What to stop measuring | What to start measuring instead | The weekly 45-minute review that actually moves numbers | Signs your current strategy isn't working | Frequently asked owner questions | Keep reading,Step 1 in more detail: the money job | Step 2 in more detail: the journey | Step 3 in more detail: fast + compounding | Want a booked-job-first plan built for your numbers? | How much of my revenue should go on marketing? | Should I brief my agency on strategy or execution? | Want a booked-job-first plan for your business? | Want the phone ringing?,Services | Industries | Locations,,
https://leadweb-vert.vercel.app/blog/cost-per-lead-benchmarks-australia/,Cost Per Lead Benchmarks Australia 2026 | Leadweb Marketing,59,"Real cost-per-lead benchmarks across Australian trades, health, legal, real estate and professional services. Know what you should be paying.",141,https://www.leadweb.com.au/blog/cost-per-lead-benchmarks-australia/,cost per lead generation bench marks,Cost Per Lead Benchmarks Across Australian Industries (2026 Data),Why the ranges are so wide | Cost per lead is the wrong ceiling — cost per booked job is the right one | What pushes your CPL down | What pushes your CPL up | Seasonal shifts every owner should plan for | How to actually use these numbers with your agency | Frequently asked owner questions | Keep reading,Want your CPL benchmarked against your industry? | Should I switch platforms if my CPL is high? | Why does my competitor claim they pay $10 a lead? | Is a $500 lead ever worth it? | Want your CPL benchmarked against your industry? | Want the phone ringing?,Services | Industries | Locations,,
https://leadweb-vert.vercel.app/blog/local-seo-for-tradies/,Local SEO for Tradies Australia | Leadweb Marketing,51,The exact local SEO playbook Australian tradies are using to rank in the Google Map Pack and beat HiPages listings in their suburb.,131,https://www.leadweb.com.au/blog/local-seo-for-tradies/,local seo for tradies,Local SEO for Tradies: How to Dominate Your Suburb on Google,How Google decides who ranks in the three-pack | The 8-step tradie Map Pack playbook | The reviews-per-month target that actually ranks | What kills tradie Map Pack rankings | Suburb pages: when they help and when they hurt | Beating HiPages in your own suburb | Frequently asked owner questions | Keep reading,Getting the primary category right | Photos that actually move rankings | Weekly posts are the free ranking signal owners ignore | Want us to audit your Google Business Profile? | Do I need a physical shopfront to rank? | Can I put keywords in my business name? | How long before I see results? | Want us to audit your Google Business Profile? | Want the phone ringing?,Services | Industries | Locations,,
https://leadweb-vert.vercel.app/blog/meta-ads-for-service-businesses/,Meta Ads for Australian Service Businesses | Leadweb Marketing,62,How Australian service businesses turn Facebook and Instagram scrolls into booked calls — with real CPL benchmarks and creative that converts.,142,https://www.leadweb.com.au/blog/meta-ads-for-service-businesses/,meta ads for service based businesses,Meta Ads for Service Businesses: From Scroll to Booked Call,Search vs Social: two very different buyers | The offer stack that works on Meta | Meta Lead Forms vs landing pages: which to use | Creative that stops the scroll | Audience layers to test in order | The 5-minute follow-up rule | What good Meta performance looks like in Australia | Frequently asked owner questions | Keep reading,"Why a specific price beats ""quality service"" | Native creative vs agency creative | Want a Meta Ads playbook built for your business? | Does Meta work for boring services (plumbing, legal, accounting)? | How much do I need to spend to test properly? | Should I run Google and Meta at the same time? | Want a Meta Ads playbook built for your business? | Want the phone ringing?",Services | Industries | Locations,,
https://leadweb-vert.vercel.app/blog/growth-marketing-vs-digital-marketing/,Growth Marketing vs Digital Marketing — Explained | Leadweb Marketing,69,"Growth marketing and digital marketing aren't the same thing. Here's the difference, when each matters, and which one you need first.",133,https://www.leadweb.com.au/blog/growth-marketing-vs-digital-marketing/,growth marketing vs digital marketing,Growth Marketing vs Digital Marketing: What's the Actual Difference?,Digital marketing: the channels | Growth marketing: the system | The overlap — and why the labels get confused | A simple growth experiment framework | Where growth marketing actually earns its keep | The hiring order for most service businesses | Red flags in either discipline | Frequently asked owner questions | Keep reading,Not sure which role you actually need? | Can one person be both? | Which pays more? | Want to know which one your business needs? | Want the phone ringing?,Services | Industries | Locations,,
https://leadweb-vert.vercel.app/blog/why-your-website-isnt-converting/,Why Your Website Isn't Converting — 7 Fixes | Leadweb Marketing,63,Traffic but no leads? Here are the 7 website fixes that lift conversion for Australian service businesses — most take under an hour.,132,https://www.leadweb.com.au/blog/why-your-website-isnt-converting/,websites conversion rate optimisation,Why Your Website Isn't Converting (And the 7 Fixes That Actually Matter),"Before the fixes: measure what's actually broken | The 7 fixes, ranked | What to stop doing | The 14-day conversion sprint | When it really is time for a rebuild | Frequently asked owner questions | Keep reading",Fix 1 in depth — speed | Fix 2 in depth — the H1 that names the outcome | Fix 3 in depth — the phone number that never hides | Fix 4 in depth — social proof that isn't stock | Fix 5 in depth — the five-field form | Fix 6 in depth — the sticky mobile CTA | Fix 7 in depth — the trust bar | Want a video walkthrough of the leaks in your site? | How much conversion lift can I realistically expect? | Do I need a designer or a developer? | Should I A/B test everything? | Want a video walkthrough of your site? | Want the phone ringing?,Services | Industries | Locations,,
https://leadweb-vert.vercel.app/blog/category/digital-marketing/,Digital Marketing — Blog Articles | Leadweb Marketing,53,"Read every Leadweb article filed under Digital Marketing. Practical, data-backed guides for Australian business owners.",119,https://www.leadweb.com.au/blog/category/digital-marketing/,,Digital Marketing,,The Digital Marketing Strategy That Actually Books Jobs (Not Just Clicks) | Meta Ads for Service Businesses: From Scroll to Booked Call | Why Your Website Isn't Converting (And the 7 Fixes That Actually Matter),Services | Industries | Locations,,
https://leadweb-vert.vercel.app/blog/category/lead-generation/,Lead Generation — Blog Articles | Leadweb Marketing,51,"Read every Leadweb article filed under Lead Generation. Practical, data-backed guides for Australian business owners.",117,https://www.leadweb.com.au/blog/category/lead-generation/,,Lead Generation,,Lead Generation for Australian Businesses in 2026: What Actually Works Now | Cost Per Lead Benchmarks Across Australian Industries (2026 Data),Services | Industries | Locations,,
https://leadweb-vert.vercel.app/blog/category/seo/,SEO — Blog Articles | Leadweb Marketing,39,"Read every Leadweb article filed under SEO. Practical, data-backed guides for Australian business owners.",105,https://www.leadweb.com.au/blog/category/seo/,,SEO,,"SEO in 2026: Ranking with AI Overviews, E-E-A-T and Fewer Clicks | Local SEO for Tradies: How to Dominate Your Suburb on Google",Services | Industries | Locations,,
https://leadweb-vert.vercel.app/blog/category/pay-per-lead/,Pay Per Lead — Blog Articles | Leadweb Marketing,48,"Read every Leadweb article filed under Pay Per Lead. Practical, data-backed guides for Australian business owners.",114,https://www.leadweb.com.au/blog/category/pay-per-lead/,,Pay Per Lead,,Pay Per Lead vs Retainer Agency: Which Model Actually Delivers ROI?,Services | Industries | Locations,,
https://leadweb-vert.vercel.app/blog/category/google-ads/,Google Ads — Blog Articles | Leadweb Marketing,46,"Read every Leadweb article filed under Google Ads. Practical, data-backed guides for Australian business owners.",112,https://www.leadweb.com.au/blog/category/google-ads/,,Google Ads,,Google Ads for Small Business: Stop Burning Budget on the Wrong Keywords,Services | Industries | Locations,,
https://leadweb-vert.vercel.app/blog/category/growth-marketing/,Growth Marketing — Blog Articles | Leadweb Marketing,52,"Read every Leadweb article filed under Growth Marketing. Practical, data-backed guides for Australian business owners.",118,https://www.leadweb.com.au/blog/category/growth-marketing/,,Growth Marketing,,Growth Marketing vs Digital Marketing: What's the Actual Difference?,Services | Industries | Locations,,
https://leadweb-vert.vercel.app/blog/tag/strategy/,Strategy — Blog Tag | Leadweb Marketing,39,Every Leadweb article tagged Strategy. Practical growth reads for Australian business owners.,93,https://www.leadweb.com.au/blog/tag/strategy/,,# Strategy,,Lead Generation for Australian Businesses in 2026: What Actually Works Now | The Digital Marketing Strategy That Actually Books Jobs (Not Just Clicks) | Growth Marketing vs Digital Marketing: What's the Actual Difference?,Services | Industries | Locations,,
https://leadweb-vert.vercel.app/blog/tag/australia/,Australia — Blog Tag | Leadweb Marketing,40,Every Leadweb article tagged Australia. Practical growth reads for Australian business owners.,94,https://www.leadweb.com.au/blog/tag/australia/,,# Australia,,Lead Generation for Australian Businesses in 2026: What Actually Works Now | Cost Per Lead Benchmarks Across Australian Industries (2026 Data),Services | Industries | Locations,,
https://leadweb-vert.vercel.app/blog/tag/benchmarks/,Benchmarks — Blog Tag | Leadweb Marketing,41,Every Leadweb article tagged Benchmarks. Practical growth reads for Australian business owners.,95,https://www.leadweb.com.au/blog/tag/benchmarks/,,# Benchmarks,,Lead Generation for Australian Businesses in 2026: What Actually Works Now | Cost Per Lead Benchmarks Across Australian Industries (2026 Data),Services | Industries | Locations,,
https://leadweb-vert.vercel.app/blog/tag/digital-marketing/,Digital Marketing — Blog Tag | Leadweb Marketing,48,Every Leadweb article tagged Digital Marketing. Practical growth reads for Australian business owners.,102,https://www.leadweb.com.au/blog/tag/digital-marketing/,,# Digital Marketing,,The Digital Marketing Strategy That Actually Books Jobs (Not Just Clicks) | Growth Marketing vs Digital Marketing: What's the Actual Difference?,Services | Industries | Locations,,
https://leadweb-vert.vercel.app/blog/tag/lead-generation/,Lead Generation — Blog Tag | Leadweb Marketing,46,Every Leadweb article tagged Lead Generation. Practical growth reads for Australian business owners.,100,https://www.leadweb.com.au/blog/tag/lead-generation/,,# Lead Generation,,Lead Generation for Australian Businesses in 2026: What Actually Works Now | Cost Per Lead Benchmarks Across Australian Industries (2026 Data),Services | Industries | Locations,,
https://leadweb-vert.vercel.app/blog/tag/seo/,SEO — Blog Tag | Leadweb Marketing,34,Every Leadweb article tagged SEO. Practical growth reads for Australian business owners.,88,https://www.leadweb.com.au/blog/tag/seo/,,# SEO,,"SEO in 2026: Ranking with AI Overviews, E-E-A-T and Fewer Clicks | Local SEO for Tradies: How to Dominate Your Suburb on Google",Services | Industries | Locations,,
https://leadweb-vert.vercel.app/blog/tag/agency-models/,Agency Models — Blog Tag | Leadweb Marketing,44,Every Leadweb article tagged Agency Models. Practical growth reads for Australian business owners.,98,https://www.leadweb.com.au/blog/tag/agency-models/,,# Agency Models,,Pay Per Lead vs Retainer Agency: Which Model Actually Delivers ROI?,Services | Industries | Locations,,
https://leadweb-vert.vercel.app/blog/tag/ai-overviews/,AI Overviews — Blog Tag | Leadweb Marketing,43,Every Leadweb article tagged AI Overviews. Practical growth reads for Australian business owners.,97,https://www.leadweb.com.au/blog/tag/ai-overviews/,,# AI Overviews,,"SEO in 2026: Ranking with AI Overviews, E-E-A-T and Fewer Clicks",Services | Industries | Locations,,
